{
  "catalogVersion": "1.0.0",
  "minClientVersion": "2.1.0",
  "sections": [
    {
      "id": "sec-00-start-safely",
      "order": 0,
      "title": "Start safely",
      "summary": "Orientation for safe first sessions in live cash poker.",
      "units": [
        {
          "id": "unit-00-01-cash-poker-map",
          "order": 1,
          "title": "Cash poker map",
          "summary": "Cash poker map for Section 0.",
          "objectiveIds": [
            "obj-cash-vs-tournament"
          ],
          "lessons": [
            {
              "id": "lesson-00-01-01-cash-vs-tournaments",
              "order": 1,
              "title": "Cash vs tournaments",
              "format": "concept",
              "objectiveIds": [
                "obj-cash-vs-tournament"
              ],
              "estimatedMinutes": 8,
              "mediaIds": [],
              "exerciseRefs": [
                "lesson-00-01-01-cash-vs-tournaments"
              ],
              "simulationClaims": "conceptual_only",
              "prerequisites": [],
              "remediationLessonIds": []
            },
            {
              "id": "lesson-00-01-02-map-a-live-cash-game",
              "order": 2,
              "title": "Map a live cash game",
              "format": "scenario",
              "objectiveIds": [
                "obj-cash-vs-tournament"
              ],
              "estimatedMinutes": 12,
              "mediaIds": [],
              "exerciseRefs": [
                "lesson-00-01-02-map-a-live-cash-game"
              ],
              "simulationClaims": "engine_supported",
              "prerequisites": [
                "lesson-00-01-01-cash-vs-tournaments"
              ],
              "remediationLessonIds": []
            },
            {
              "id": "lesson-00-01-03-cash-poker-map-check",
              "order": 3,
              "title": "Cash poker map check",
              "format": "assessment",
              "objectiveIds": [
                "obj-cash-vs-tournament"
              ],
              "estimatedMinutes": 10,
              "mediaIds": [],
              "exerciseRefs": [
                "lesson-00-01-03-cash-poker-map-check"
              ],
              "simulationClaims": "engine_supported",
              "prerequisites": [
                "lesson-00-01-02-map-a-live-cash-game"
              ],
              "remediationLessonIds": [
                "lesson-00-01-01-cash-vs-tournaments"
              ]
            }
          ]
        },
        {
          "id": "unit-00-02-your-first-orbit",
          "order": 2,
          "title": "Your first orbit",
          "summary": "Your first orbit for Section 0.",
          "objectiveIds": [
            "obj-table-flow"
          ],
          "lessons": [
            {
              "id": "lesson-00-02-01-table-flow-and-seating",
              "order": 1,
              "title": "Table flow and seating",
              "format": "concept",
              "objectiveIds": [
                "obj-table-flow"
              ],
              "estimatedMinutes": 8,
              "mediaIds": [],
              "exerciseRefs": [
                "lesson-00-02-01-table-flow-and-seating"
              ],
              "simulationClaims": "conceptual_only",
              "prerequisites": [
                "lesson-00-01-03-cash-poker-map-check"
              ],
              "remediationLessonIds": []
            },
            {
              "id": "lesson-00-02-02-survive-your-first-orbit",
              "order": 2,
              "title": "Survive your first orbit",
              "format": "scenario",
              "objectiveIds": [
                "obj-table-flow"
              ],
              "estimatedMinutes": 12,
              "mediaIds": [],
              "exerciseRefs": [
                "lesson-00-02-02-survive-your-first-orbit"
              ],
              "simulationClaims": "engine_supported",
              "prerequisites": [
                "lesson-00-02-01-table-flow-and-seating"
              ],
              "remediationLessonIds": []
            },
            {
              "id": "lesson-00-02-03-first-orbit-check",
              "order": 3,
              "title": "First orbit check",
              "format": "assessment",
              "objectiveIds": [
                "obj-table-flow"
              ],
              "estimatedMinutes": 10,
              "mediaIds": [],
              "exerciseRefs": [
                "lesson-00-02-03-first-orbit-check"
              ],
              "simulationClaims": "engine_supported",
              "prerequisites": [
                "lesson-00-02-02-survive-your-first-orbit"
              ],
              "remediationLessonIds": [
                "lesson-00-02-01-table-flow-and-seating"
              ]
            }
          ]
        },
        {
          "id": "unit-00-03-safe-start-essentials",
          "order": 3,
          "title": "Safe-start essentials",
          "summary": "Safe-start essentials for Section 0.",
          "objectiveIds": [
            "obj-safe-session"
          ],
          "lessons": [
            {
              "id": "lesson-00-03-01-bankroll-and-session-basics",
              "order": 1,
              "title": "Bankroll and session basics",
              "format": "concept",
              "objectiveIds": [
                "obj-safe-session"
              ],
              "estimatedMinutes": 8,
              "mediaIds": [],
              "exerciseRefs": [
                "lesson-00-03-01-bankroll-and-session-basics"
              ],
              "simulationClaims": "conceptual_only",
              "prerequisites": [
                "lesson-00-02-03-first-orbit-check"
              ],
              "remediationLessonIds": []
            },
            {
              "id": "lesson-00-03-02-choose-a-safe-first-session",
              "order": 2,
              "title": "Choose a safe first session",
              "format": "decision_drill",
              "objectiveIds": [
                "obj-safe-session"
              ],
              "estimatedMinutes": 12,
              "mediaIds": [],
              "exerciseRefs": [
                "lesson-00-03-02-choose-a-safe-first-session"
              ],
              "simulationClaims": "engine_supported",
              "prerequisites": [
                "lesson-00-03-01-bankroll-and-session-basics"
              ],
              "remediationLessonIds": []
            },
            {
              "id": "lesson-00-03-03-safe-start-check",
              "order": 3,
              "title": "Safe-start check",
              "format": "assessment",
              "objectiveIds": [
                "obj-safe-session"
              ],
              "estimatedMinutes": 10,
              "mediaIds": [],
              "exerciseRefs": [
                "lesson-00-03-03-safe-start-check"
              ],
              "simulationClaims": "engine_supported",
              "prerequisites": [
                "lesson-00-03-02-choose-a-safe-first-session"
              ],
              "remediationLessonIds": [
                "lesson-00-03-01-bankroll-and-session-basics"
              ]
            }
          ]
        }
      ]
    },
    {
      "id": "sec-01-rules-and-live-table-execution",
      "order": 1,
      "title": "Rules and live-table execution",
      "summary": "Rules, action order, and live-room execution skills.",
      "units": [
        {
          "id": "unit-01-01-hands-and-showdowns",
          "order": 1,
          "title": "Hands and showdowns",
          "summary": "Hands and showdowns for Section 1.",
          "objectiveIds": [
            "obj-hand-rankings"
          ],
          "lessons": [
            {
              "id": "lesson-01-01-01-hand-rankings-and-showdown-order",
              "order": 1,
              "title": "Hand rankings and showdown order",
              "format": "concept",
              "objectiveIds": [
                "obj-hand-rankings"
              ],
              "estimatedMinutes": 8,
              "mediaIds": [],
              "exerciseRefs": [
                "lesson-01-01-01-hand-rankings-and-showdown-order"
              ],
              "simulationClaims": "conceptual_only",
              "prerequisites": [
                "lesson-00-03-03-safe-start-check"
              ],
              "remediationLessonIds": []
            },
            {
              "id": "lesson-01-01-02-resolve-contested-showdowns",
              "order": 2,
              "title": "Resolve contested showdowns",
              "format": "decision_drill",
              "objectiveIds": [
                "obj-hand-rankings"
              ],
              "estimatedMinutes": 12,
              "mediaIds": [],
              "exerciseRefs": [
                "lesson-01-01-02-resolve-contested-showdowns"
              ],
              "simulationClaims": "engine_supported",
              "prerequisites": [
                "lesson-01-01-01-hand-rankings-and-showdown-order"
              ],
              "remediationLessonIds": []
            },
            {
              "id": "lesson-01-01-03-hands-and-showdowns-check",
              "order": 3,
              "title": "Hands and showdowns check",
              "format": "assessment",
              "objectiveIds": [
                "obj-hand-rankings"
              ],
              "estimatedMinutes": 10,
              "mediaIds": [],
              "exerciseRefs": [
                "lesson-01-01-03-hands-and-showdowns-check"
              ],
              "simulationClaims": "engine_supported",
              "prerequisites": [
                "lesson-01-01-02-resolve-contested-showdowns"
              ],
              "remediationLessonIds": [
                "lesson-01-01-01-hand-rankings-and-showdown-order"
              ]
            }
          ]
        },
        {
          "id": "unit-01-02-action-and-position",
          "order": 2,